{
  "schema_version": 1,
  "id": "zone_town_01",
  "kind": "town",
  "width": 20,
  "height": 15,
  "tile_size": 16,
  "tileset": "overworld_temperate",
  "layers": {
    "ground": [
      1,
      1,
      1,
      1,
      1,
      1,
      1,
      1,
      1,
      1,
      2,
      1,
      1,
      1,
      1,
      1,
      1,
      1,
      1,
      1,
      1,
      1,
      1,
      1,
      1,
      1,
      1,
      1,
      1,
      2,
      2,
      1,
      1,
      1,
      1,
      1,
      1,
      1,
      1,
      1,
      1,
      1,
      1,
      1,
      1,
      1,
      1,
      1,
      1,
      2,
      2,
      1,
      1,
      1,
      1,
      1,
      1,
      1,
      1,
      1,
      1,
      1,
      1,
      1,
      1,
      1,
      1,
      1,
      1,
      2,
      2,
      1,
      1,
      1,
      1,
      1,
      1,
      1,
      1,
      1,
      1,
      1,
      1,
      1,
      1,
      1,
      1,
      1,
      1,
      2,
      2,
      1,
      1,
      1,
      1,
      1,
      1,
      1,
      1,
      1,
      1,
      1,
      1,
      2,
      2,
      2,
      2,
      2,
      2,
      2,
      2,
      2,
      2,
      2,
      2,
      2,
      2,
      1,
      1,
      1,
      1,
      1,
      1,
      1,
      1,
      1,
      1,
      1,
      1,
      2,
      2,
      1,
      1,
      1,
      1,
      1,
      1,
      1,
      1,
      1,
      1,
      1,
      1,
      1,
      1,
      1,
      1,
      1,
      1,
      2,
      2,
      1,
      1,
      1,
      1,
      1,
      1,
      1,
      1,
      1,
      1,
      1,
      1,
      1,
      1,
      1,
      1,
      1,
      1,
      2,
      2,
      1,
      1,
      1,
      1,
      1,
      1,
      1,
      1,
      1,
      1,
      1,
      1,
      1,
      1,
      1,
      1,
      1,
      1,
      2,
      2,
      1,
      1,
      1,
      1,
      1,
      1,
      1,
      1,
      1,
      1,
      1,
      1,
      1,
      1,
      1,
      1,
      1,
      1,
      2,
      2,
      1,
      1,
      1,
      1,
      1,
      1,
      1,
      1,
      1,
      1,
      1,
      1,
      1,
      1,
      1,
      1,
      1,
      1,
      2,
      2,
      1,
      1,
      1,
      1,
      1,
      1,
      1,
      1,
      1,
      1,
      1,
      1,
      1,
      1,
      1,
      1,
      1,
      1,
      2,
      2,
      1,
      1,
      1,
      1,
      1,
      1,
      1,
      1,
      1,
      3,
      3,
      3,
      3,
      3,
      3,
      3,
      3,
      3,
      4,
      4,
      3,
      3,
      3,
      3,
      3,
      3,
      3,
      3,
      3,
      3,
      3,
      3,
      3,
      3,
      3,
      3,
      3,
      3,
      3,
      3,
      3,
      3,
      3,
      3,
      3,
      3,
      3,
      3,
      3
    ],
    "decor": [
      16,
      16,
      16,
      16,
      16,
      16,
      16,
      16,
      16,
      16,
      0,
      16,
      16,
      16,
      16,
      16,
      16,
      16,
      16,
      16,
      16,
      0,
      0,
      22,
      0,
      0,
      0,
      0,
      0,
      0,
      0,
      0,
      0,
      0,
      0,
      0,
      22,
      0,
      0,
      16,
      16,
      0,
      17,
      17,
      17,
      17,
      0,
      0,
      0,
      0,
      0,
      0,
      0,
      0,
      17,
      17,
      17,
      17,
      0,
      16,
      16,
      0,
      17,
      18,
      18,
      17,
      0,
      0,
      0,
      0,
      0,
      0,
      0,
      0,
      17,
      18,
      18,
      17,
      0,
      16,
      16,
      0,
      0,
      0,
      0,
      0,
      0,
      0,
      0,
      0,
      0,
      0,
      0,
      0,
      0,
      0,
      0,
      0,
      0,
      16,
      16,
      0,
      0,
      0,
      0,
      0,
      0,
      0,
      0,
      0,
      0,
      0,
      0,
      0,
      0,
      0,
      0,
      0,
      0,
      16,
      16,
      0,
      0,
      0,
      0,
      0,
      0,
      0,
      0,
      0,
      0,
      0,
      19,
      0,
      0,
      0,
      0,
      0,
      0,
      16,
      16,
      0,
      0,
      0,
      0,
      0,
      0,
      0,
      0,
      0,
      0,
      0,
      0,
      0,
      0,
      0,
      0,
      0,
      0,
      16,
      16,
      0,
      17,
      17,
      17,
      17,
      0,
      0,
      0,
      0,
      0,
      0,
      0,
      0,
      17,
      17,
      17,
      17,
      0,
      16,
      16,
      0,
      17,
      18,
      18,
      17,
      0,
      0,
      0,
      0,
      0,
      0,
      0,
      0,
      17,
      18,
      18,
      17,
      0,
      16,
      16,
      0,
      0,
      0,
      0,
      0,
      0,
      0,
      0,
      0,
      0,
      0,
      0,
      0,
      0,
      0,
      0,
      0,
      0,
      16,
      16,
      0,
      0,
      20,
      20,
      20,
      0,
      0,
      0,
      0,
      0,
      0,
      0,
      0,
      20,
      20,
      20,
      0,
      0,
      16,
      16,
      0,
      0,
      0,
      0,
      0,
      0,
      0,
      0,
      0,
      0,
      0,
      0,
      0,
      0,
      0,
      0,
      0,
      0,
      16,
      0,
      0,
      0,
      0,
      0,
      0,
      0,
      0,
      0,
      0,
      0,
      0,
      0,
      0,
      0,
      0,
      0,
      0,
      0,
      0,
      0,
      0,
      0,
      0,
      0,
      0,
      0,
      0,
      0,
      0,
      0,
      0,
      0,
      0,
      0,
      0,
      0,
      0,
      0,
      0
    ],
    "collision": [
      1,
      1,
      1,
      1,
      1,
      1,
      1,
      1,
      1,
      1,
      0,
      1,
      1,
      1,
      1,
      1,
      1,
      1,
      1,
      1,
      1,
      0,
      0,
      0,
      0,
      0,
      0,
      0,
      0,
      0,
      0,
      0,
      0,
      0,
      0,
      0,
      0,
      0,
      0,
      1,
      1,
      0,
      1,
      1,
      1,
      1,
      0,
      0,
      0,
      0,
      0,
      0,
      0,
      0,
      1,
      1,
      1,
      1,
      0,
      1,
      1,
      0,
      1,
      1,
      1,
      1,
      0,
      0,
      0,
      0,
      0,
      0,
      0,
      0,
      1,
      1,
      1,
      1,
      0,
      1,
      1,
      0,
      0,
      0,
      0,
      0,
      0,
      0,
      0,
      0,
      0,
      0,
      0,
      0,
      0,
      0,
      0,
      0,
      0,
      1,
      1,
      0,
      0,
      0,
      0,
      0,
      0,
      0,
      0,
      0,
      0,
      0,
      0,
      0,
      0,
      0,
      0,
      0,
      0,
      1,
      1,
      0,
      0,
      0,
      0,
      0,
      0,
      0,
      0,
      0,
      0,
      0,
      1,
      0,
      0,
      0,
      0,
      0,
      0,
      1,
      1,
      0,
      0,
      0,
      0,
      0,
      0,
      0,
      0,
      0,
      0,
      0,
      0,
      0,
      0,
      0,
      0,
      0,
      0,
      1,
      1,
      0,
      1,
      1,
      1,
      1,
      0,
      0,
      0,
      0,
      0,
      0,
      0,
      0,
      1,
      1,
      1,
      1,
      0,
      1,
      1,
      0,
      1,
      1,
      1,
      1,
      0,
      0,
      0,
      0,
      0,
      0,
      0,
      0,
      1,
      1,
      1,
      1,
      0,
      1,
      1,
      0,
      0,
      0,
      0,
      0,
      0,
      0,
      0,
      0,
      0,
      0,
      0,
      0,
      0,
      0,
      0,
      0,
      0,
      1,
      1,
      0,
      0,
      1,
      1,
      1,
      0,
      0,
      0,
      0,
      0,
      0,
      0,
      0,
      1,
      1,
      1,
      0,
      0,
      1,
      1,
      0,
      0,
      0,
      0,
      0,
      0,
      0,
      0,
      0,
      0,
      0,
      0,
      0,
      0,
      0,
      0,
      0,
      0,
      1,
      1,
      1,
      1,
      1,
      1,
      1,
      1,
      1,
      1,
      0,
      0,
      1,
      1,
      1,
      1,
      1,
      1,
      1,
      1,
      1,
      1,
      1,
      1,
      1,
      1,
      1,
      1,
      1,
      1,
      1,
      1,
      1,
      1,
      1,
      1,
      1,
      1,
      1,
      1,
      1
    ]
  },
  "entities": [
    {
      "id": "npc_mayor_helle",
      "type": "npc",
      "x": 7,
      "y": 4,
      "sprite_tags": [
        "human",
        "elder",
        "authority",
        "biome:temperate"
      ],
      "display_name": "Mayor Helle",
      "trigger": "interact",
      "script": [
        {
          "op": "IF_FLAG",
          "flag": "met_mayor",
          "then": [
            {
              "op": "SHOW_TEXT",
              "speaker": "Mayor Helle",
              "text": "Still here? The road north is open. I'd sooner you stayed and helped with the sandbags, but I know better than to ask twice."
            }
          ],
          "else": [
            {
              "op": "SHOW_TEXT",
              "speaker": "Mayor Helle",
              "text": "You'll be the ones from the guild, then. Callow Ford thanks you for coming, though I wish it were a happier errand."
            },
            {
              "op": "SHOW_TEXT",
              "speaker": "Mayor Helle",
              "text": "The mine flooded nine days ago. Since then the river runs warm, and nobody who walks up that road walks back down it."
            },
            {
              "op": "SHOW_CHOICE",
              "speaker": "Mayor Helle",
              "prompt": "Will you go up and look?",
              "options": [
                {
                  "label": "We'll go.",
                  "script": [
                    {
                      "op": "SHOW_TEXT",
                      "speaker": "Mayor Helle",